{
  "$schema": "http://json-schema.org/draft-07/schema#",
  "title": "Claude Code Marketplace Schema",
  "description": "Schema for validating marketplace.json files according to official documentation",
  "type": "object",
  "required": ["name", "owner", "plugins"],
  "properties": {
    "name": {
      "type": "string",
      "pattern": "^[a-z0-9]+(-[a-z0-9]+)*$",
      "description": "Marketplace identifier in kebab-case"
    },
    "owner": {
      "type": "object",
      "required": ["name"],
      "properties": {
        "name": {
          "type": "string",
          "minLength": 1
        },
        "email": {
          "type": "string",
          "format": "email"
        },
        "url": {
          "type": "string",
          "format": "uri"
        }
      }
    },
    "metadata": {
      "type": "object",
      "properties": {
        "description": {
          "type": "string"
        },
        "version": {
          "type": "string",
          "pattern": "^\\d+\\.\\d+\\.\\d+$",
          "description": "Semantic version (MAJOR.MINOR.PATCH)"
        },
        "pluginRoot": {
          "type": "string"
        }
      }
    },
    "plugins": {
      "type": "array",
      "minItems": 1,
      "items": {
        "type": "object",
        "required": ["name", "source"],
        "properties": {
          "name": {
            "type": "string",
            "pattern": "^[a-z0-9]+(-[a-z0-9]+)*$",
            "description": "Plugin identifier in kebab-case"
          },
          "source": {
            "oneOf": [
              {
                "type": "string",
                "pattern": "^\\./.*",
                "description": "Relative path"
              },
              {
                "type": "object",
                "required": ["source", "repo"],
                "properties": {
                  "source": {
                    "const": "github"
                  },
                  "repo": {
                    "type": "string",
                    "pattern": "^[^/]+/[^/]+$"
                  }
                }
              },
              {
                "type": "string",
                "format": "uri",
                "description": "Git URL"
              }
            ]
          },
          "description": {
            "type": "string"
          },
          "version": {
            "type": "string",
            "pattern": "^\\d+\\.\\d+\\.\\d+$"
          },
          "category": {
            "type": "string"
          },
          "tags": {
            "type": "array",
            "items": {
              "type": "string"
            }
          },
          "author": {
            "type": "object",
            "properties": {
              "name": {
                "type": "string"
              },
              "email": {
                "type": "string",
                "format": "email"
              },
              "url": {
                "type": "string",
                "format": "uri"
              }
            }
          },
          "license": {
            "type": "string"
          }
        }
      }
    }
  }
}
